[
  {
    "evidence_id": "block0",
    "observation": {
      "frame_state": "none",
      "http_status": 403,
      "text": "Access denied",
      "title": "Fixture article",
      "tool_error": "none",
      "truncated": false,
      "usable_marker": false
    },
    "schema_version": "1.0",
    "snapshot_sha256": "f4d9551798291aac855cf64764981c9b72ee536f21520cc908432d7bc58b1091",
    "target_id": "block0"
  },
  {
    "evidence_id": "block1",
    "observation": {
      "frame_state": "none",
      "http_status": 403,
      "text": "Access denied",
      "title": "Fixture article",
      "tool_error": "none",
      "truncated": false,
      "usable_marker": false
    },
    "schema_version": "1.0",
    "snapshot_sha256": "f4d9551798291aac855cf64764981c9b72ee536f21520cc908432d7bc58b1091",
    "target_id": "block1"
  },
  {
    "evidence_id": "block2",
    "observation": {
      "frame_state": "none",
      "http_status": 403,
      "text": "Access denied",
      "title": "Fixture article",
      "tool_error": "none",
      "truncated": false,
      "usable_marker": false
    },
    "schema_version": "1.0",
    "snapshot_sha256": "f4d9551798291aac855cf64764981c9b72ee536f21520cc908432d7bc58b1091",
    "target_id": "block2"
  },
  {
    "evidence_id": "block3",
    "observation": {
      "frame_state": "none",
      "http_status": 403,
      "text": "Access denied",
      "title": "Fixture article",
      "tool_error": "none",
      "truncated": false,
      "usable_marker": false
    },
    "schema_version": "1.0",
    "snapshot_sha256": "f4d9551798291aac855cf64764981c9b72ee536f21520cc908432d7bc58b1091",
    "target_id": "block3"
  },
  {
    "evidence_id": "block4",
    "observation": {
      "frame_state": "none",
      "http_status": 403,
      "text": "Access denied",
      "title": "Fixture article",
      "tool_error": "none",
      "truncated": false,
      "usable_marker": false
    },
    "schema_version": "1.0",
    "snapshot_sha256": "f4d9551798291aac855cf64764981c9b72ee536f21520cc908432d7bc58b1091",
    "target_id": "block4"
  },
  {
    "evidence_id": "block5",
    "observation": {
      "frame_state": "none",
      "http_status": 403,
      "text": "Access denied",
      "title": "Fixture article",
      "tool_error": "none",
      "truncated": false,
      "usable_marker": false
    },
    "schema_version": "1.0",
    "snapshot_sha256": "f4d9551798291aac855cf64764981c9b72ee536f21520cc908432d7bc58b1091",
    "target_id": "block5"
  },
  {
    "evidence_id": "block6",
    "observation": {
      "frame_state": "none",
      "http_status": 403,
      "text": "Access denied",
      "title": "Fixture article",
      "tool_error": "none",
      "truncated": false,
      "usable_marker": false
    },
    "schema_version": "1.0",
    "snapshot_sha256": "f4d9551798291aac855cf64764981c9b72ee536f21520cc908432d7bc58b1091",
    "target_id": "block6"
  },
  {
    "evidence_id": "block7",
    "observation": {
      "frame_state": "none",
      "http_status": 403,
      "text": "Access denied",
      "title": "Fixture article",
      "tool_error": "none",
      "truncated": false,
      "usable_marker": false
    },
    "schema_version": "1.0",
    "snapshot_sha256": "f4d9551798291aac855cf64764981c9b72ee536f21520cc908432d7bc58b1091",
    "target_id": "block7"
  },
  {
    "evidence_id": "block8",
    "observation": {
      "frame_state": "none",
      "http_status": 403,
      "text": "Access denied",
      "title": "Fixture article",
      "tool_error": "none",
      "truncated": false,
      "usable_marker": false
    },
    "schema_version": "1.0",
    "snapshot_sha256": "f4d9551798291aac855cf64764981c9b72ee536f21520cc908432d7bc58b1091",
    "target_id": "block8"
  },
  {
    "evidence_id": "captcha0",
    "observation": {
      "frame_state": "none",
      "http_status": 200,
      "text": "Complete the CAPTCHA to continue",
      "title": "Fixture article",
      "tool_error": "none",
      "truncated": false,
      "usable_marker": false
    },
    "schema_version": "1.0",
    "snapshot_sha256": "e22bbd5925a8264bea2dc040144314acc166202e126a1f87d2829afbcd12c28c",
    "target_id": "captcha0"
  },
  {
    "evidence_id": "captcha1",
    "observation": {
      "frame_state": "none",
      "http_status": 200,
      "text": "Complete the CAPTCHA to continue",
      "title": "Fixture article",
      "tool_error": "none",
      "truncated": false,
      "usable_marker": false
    },
    "schema_version": "1.0",
    "snapshot_sha256": "e22bbd5925a8264bea2dc040144314acc166202e126a1f87d2829afbcd12c28c",
    "target_id": "captcha1"
  },
  {
    "evidence_id": "captcha2",
    "observation": {
      "frame_state": "none",
      "http_status": 200,
      "text": "Complete the CAPTCHA to continue",
      "title": "Fixture article",
      "tool_error": "none",
      "truncated": false,
      "usable_marker": false
    },
    "schema_version": "1.0",
    "snapshot_sha256": "e22bbd5925a8264bea2dc040144314acc166202e126a1f87d2829afbcd12c28c",
    "target_id": "captcha2"
  },
  {
    "evidence_id": "captcha3",
    "observation": {
      "frame_state": "none",
      "http_status": 200,
      "text": "Complete the CAPTCHA to continue",
      "title": "Fixture article",
      "tool_error": "none",
      "truncated": false,
      "usable_marker": false
    },
    "schema_version": "1.0",
    "snapshot_sha256": "e22bbd5925a8264bea2dc040144314acc166202e126a1f87d2829afbcd12c28c",
    "target_id": "captcha3"
  },
  {
    "evidence_id": "captcha4",
    "observation": {
      "frame_state": "none",
      "http_status": 200,
      "text": "Complete the CAPTCHA to continue",
      "title": "Fixture article",
      "tool_error": "none",
      "truncated": false,
      "usable_marker": false
    },
    "schema_version": "1.0",
    "snapshot_sha256": "e22bbd5925a8264bea2dc040144314acc166202e126a1f87d2829afbcd12c28c",
    "target_id": "captcha4"
  },
  {
    "evidence_id": "captcha5",
    "observation": {
      "frame_state": "none",
      "http_status": 200,
      "text": "Complete the CAPTCHA to continue",
      "title": "Fixture article",
      "tool_error": "none",
      "truncated": false,
      "usable_marker": false
    },
    "schema_version": "1.0",
    "snapshot_sha256": "e22bbd5925a8264bea2dc040144314acc166202e126a1f87d2829afbcd12c28c",
    "target_id": "captcha5"
  },
  {
    "evidence_id": "captcha6",
    "observation": {
      "frame_state": "none",
      "http_status": 200,
      "text": "Complete the CAPTCHA to continue",
      "title": "Fixture article",
      "tool_error": "none",
      "truncated": false,
      "usable_marker": false
    },
    "schema_version": "1.0",
    "snapshot_sha256": "e22bbd5925a8264bea2dc040144314acc166202e126a1f87d2829afbcd12c28c",
    "target_id": "captcha6"
  },
  {
    "evidence_id": "captcha7",
    "observation": {
      "frame_state": "none",
      "http_status": 200,
      "text": "Complete the CAPTCHA to continue",
      "title": "Fixture article",
      "tool_error": "none",
      "truncated": false,
      "usable_marker": false
    },
    "schema_version": "1.0",
    "snapshot_sha256": "e22bbd5925a8264bea2dc040144314acc166202e126a1f87d2829afbcd12c28c",
    "target_id": "captcha7"
  },
  {
    "evidence_id": "captcha8",
    "observation": {
      "frame_state": "none",
      "http_status": 200,
      "text": "Complete the CAPTCHA to continue",
      "title": "Fixture article",
      "tool_error": "none",
      "truncated": false,
      "usable_marker": false
    },
    "schema_version": "1.0",
    "snapshot_sha256": "e22bbd5925a8264bea2dc040144314acc166202e126a1f87d2829afbcd12c28c",
    "target_id": "captcha8"
  },
  {
    "evidence_id": "challenge0",
    "observation": {
      "frame_state": "none",
      "http_status": 503,
      "text": "Checking your browser",
      "title": "Just a moment...",
      "tool_error": "none",
      "truncated": false,
      "usable_marker": false
    },
    "schema_version": "1.0",
    "snapshot_sha256": "2affb90491f7a958e2d7470ec76df338e0531681920a95789c6853c39ef3ebff",
    "target_id": "challenge0"
  },
  {
    "evidence_id": "challenge1",
    "observation": {
      "frame_state": "none",
      "http_status": 503,
      "text": "Checking your browser",
      "title": "Just a moment...",
      "tool_error": "none",
      "truncated": false,
      "usable_marker": false
    },
    "schema_version": "1.0",
    "snapshot_sha256": "2affb90491f7a958e2d7470ec76df338e0531681920a95789c6853c39ef3ebff",
    "target_id": "challenge1"
  },
  {
    "evidence_id": "challenge2",
    "observation": {
      "frame_state": "none",
      "http_status": 503,
      "text": "Checking your browser",
      "title": "Just a moment...",
      "tool_error": "none",
      "truncated": false,
      "usable_marker": false
    },
    "schema_version": "1.0",
    "snapshot_sha256": "2affb90491f7a958e2d7470ec76df338e0531681920a95789c6853c39ef3ebff",
    "target_id": "challenge2"
  },
  {
    "evidence_id": "challenge3",
    "observation": {
      "frame_state": "none",
      "http_status": 503,
      "text": "Checking your browser",
      "title": "Just a moment...",
      "tool_error": "none",
      "truncated": false,
      "usable_marker": false
    },
    "schema_version": "1.0",
    "snapshot_sha256": "2affb90491f7a958e2d7470ec76df338e0531681920a95789c6853c39ef3ebff",
    "target_id": "challenge3"
  },
  {
    "evidence_id": "challenge4",
    "observation": {
      "frame_state": "none",
      "http_status": 503,
      "text": "Checking your browser",
      "title": "Just a moment...",
      "tool_error": "none",
      "truncated": false,
      "usable_marker": false
    },
    "schema_version": "1.0",
    "snapshot_sha256": "2affb90491f7a958e2d7470ec76df338e0531681920a95789c6853c39ef3ebff",
    "target_id": "challenge4"
  },
  {
    "evidence_id": "challenge5",
    "observation": {
      "frame_state": "none",
      "http_status": 503,
      "text": "Checking your browser",